[{"ac1":8420,"category":"Product Sales","categoryIndex":1,"operation":"+","pl1":8200,"pp1":7650,"rowGroup":"Revenue","rowGroupIndex":1},{"ac1":3250,"category":"Services","categoryIndex":2,"operation":"+","pl1":3100,"pp1":2900,"rowGroup":"Revenue","rowGroupIndex":1},{"ac1":2000,"category":"Licensing","categoryIndex":3,"operation":"+","pl1":1900,"pp1":1850,"rowGroup":"Revenue","rowGroupIndex":1},{"ac1":5100,"category":"Personnel","categoryIndex":4,"operation":"-","pl1":5000,"pp1":4800,"rowGroup":"Costs","rowGroupIndex":2},{"ac1":1800,"category":"Infrastructure","categoryIndex":5,"operation":"-","pl1":1700,"pp1":1650,"rowGroup":"Costs","rowGroupIndex":2},{"ac1":2200,"category":"Marketing","categoryIndex":6,"operation":"-","pl1":2100,"pp1":1900,"rowGroup":"Costs","rowGroupIndex":2}]