[{"ac1":4250,"category":"DACH","categoryIndex":1,"fc1":4400,"operation":"+","pl1":4100,"pp1":3800},{"ac1":2870,"category":"Nordics","categoryIndex":2,"fc1":3100,"operation":"+","pl1":2900,"pp1":2650},{"ac1":3120,"category":"UK \u0026 Ireland","categoryIndex":3,"fc1":3350,"operation":"+","pl1":3200,"pp1":3400},{"ac1":1980,"category":"Southern Europe","categoryIndex":4,"fc1":2200,"operation":"+","pl1":2100,"pp1":1750},{"ac1":1450,"category":"Eastern Europe","categoryIndex":5,"fc1":1600,"operation":"+","pl1":1500,"pp1":1200}]